{
  "name": "three-node-replicate",
  "nodes": [1, 2, 3],
  "election_ticks": {
    "1": 10,
    "2": 15,
    "3": 20
  },
  "heartbeat_ticks": 3,
  "steps": [
    {
      "op": "tick_all",
      "count": 11
    },
    {
      "op": "deliver"
    },
    {
      "op": "propose",
      "node": 1,
      "command": "x=1"
    },
    {
      "op": "propose",
      "node": 1,
      "command": "y=2"
    },
    {
      "op": "propose",
      "node": 1,
      "command": "z=3"
    },
    {
      "op": "deliver"
    }
  ]
}
